{
  "task": "r04-out-of-the-box-onboarding",
  "generated": "2026-09-16 12:28 WITA",
  "claimsFile": "claims.json",
  "services": [
    {
      "id": "robokassa",
      "name": "Robokassa",
      "kind": "payment",
      "partnerProgram": {
        "exists": true,
        "type": "referral",
        "url": "https://robokassa.com/partners/",
        "entry": "заявка → анкета → оферта онлайн, без вложений и KPI",
        "reward": "процент от оборота привлечённых клиентов + спецтариф клиенту",
        "onBehalfRegistration": "не запрещено, но риск на клиенте",
        "claims": [
          "R1",
          "R2",
          "R3",
          "R4"
        ]
      },
      "onboarding": {
        "timing": "заявка обрабатывается за рабочий день; у платной услуги Robokassa — приём платежей за 1 день",
        "steps": [
          {
            "n": 1,
            "title": "Регистрация магазина в Robokassa и заполнение анкеты (ИНН, данные магазина, товары)",
            "who": "можем сделать мы",
            "why": "через партнёрский виджет регистрации клиент заполняет форму у нас",
            "claims": [
              "R2"
            ]
          },
          {
            "n": 2,
            "title": "Идентификация получателя, представителя и бенефициара по 115-ФЗ",
            "who": "только клиент",
            "why": "закон требует оригиналы документов и подтверждение достоверности",
            "claims": [
              "R9"
            ]
          },
          {
            "n": 3,
            "title": "Частичная активация: Robokassa проверяет данные и присваивает номер учётной записи",
            "who": "делает клиент",
            "why": "решение принимает Robokassa, мы только сопровождаем",
            "claims": [
              "R7"
            ]
          },
          {
            "n": 4,
            "title": "Платёж 1 ₽ с расчётного счёта магазина с точной формулировкой назначения платежа",
            "who": "только клиент",
            "why": "платёж должен уйти со счёта получателя, это и есть подтверждение присоединения к договору",
            "claims": [
              "R5",
              "R6"
            ]
          },
          {
            "n": 5,
            "title": "Полная активация — можно выводить деньги (самозанятым шаг 4 не нужен)",
            "who": "делает клиент",
            "why": "у самозанятых полная активация наступает вместе с частичной",
            "claims": [
              "R8"
            ]
          },
          {
            "n": 6,
            "title": "Интеграция: ключи в панель магазина, Result URL, тестовая оплата",
            "who": "можем сделать мы",
            "why": "это наша часть работы, ключи вводит владелец в своей панели",
            "claims": []
          }
        ]
      },
      "moneyFlow": {
        "throughUs": false,
        "note": "Перечисление идёт в пользу получателя (магазина); наше вознаграждение — процент от Robokassa, от него можно отказаться в пользу тарифа клиенту",
        "claims": [
          "R13",
          "R1"
        ]
      },
      "credentials": {
        "model": "вход в кабинет по одноразовому коду на телефон получателя либо коротким паролем в мобильном приложении Robokassa App",
        "sharingRule": "не найдено в источниках",
        "claims": [
          "R10",
          "R9"
        ]
      },
      "sourcesClosed": [],
      "gaps": [
        "Прямого запрета на передачу логина/пароля в договоре ред. 27.1 не найдено — но вход завязан на телефон клиента, поэтому «отдать логин и пароль» технически не про Robokassa",
        "Партнёрская оферта Robokassa отдельным файлом на сайте не опубликована — условия видны после заявки"
      ]
    },
    {
      "id": "yookassa",
      "name": "ЮKassa",
      "kind": "payment",
      "partnerProgram": {
        "exists": true,
        "type": "agency+platform",
        "url": "https://promo.yookassa.ru/agents",
        "entry": "заявка на agents@yoomoney.ru → индивидуальный агентский договор (форма приложения №10.1 к Правилам)",
        "reward": "процент от комиссии Оператора по привлечённым поставщикам, отчёт и выплата раз в месяц",
        "onBehalfRegistration": "не найдено в источниках",
        "claims": [
          "Y1",
          "Y2",
          "Y3",
          "Y4",
          "Y5",
          "Y6"
        ]
      },
      "onboarding": {
        "timing": "проверка — пара дней; подключение онлайн от 1 рабочего дня",
        "steps": [
          {
            "n": 1,
            "title": "Регистрация в ЮKassa: телефон, имя, почта, форма бизнеса, ИНН, собственный пароль",
            "who": "делает клиент",
            "why": "пароль создаёт сам контрагент, сервис его не выдаёт",
            "claims": [
              "Y7",
              "Y13"
            ]
          },
          {
            "n": 2,
            "title": "Заполнение данных для договора: реквизиты, сведения о регистрации, цветной снимок паспорта владельцев",
            "who": "только клиент",
            "why": "нужны персональные документы владельцев бизнеса",
            "claims": [
              "Y8"
            ]
          },
          {
            "n": 3,
            "title": "Отправка данных на проверку; ЮKassa заходит на сайт магазина",
            "who": "можем сделать мы",
            "why": "сайт готовим мы, поэтому и возврат на доработку закрываем мы",
            "claims": [
              "Y9"
            ]
          },
          {
            "n": 4,
            "title": "Подписание договора в кабинете — от руки или кодом из СМС",
            "who": "только клиент",
            "why": "код приходит на телефон клиента",
            "claims": [
              "Y10"
            ]
          },
          {
            "n": 5,
            "title": "Интеграция: shopId и секретный ключ в панель магазина, тестовый платёж",
            "who": "можем сделать мы",
            "why": "наша часть работы",
            "claims": []
          }
        ]
      },
      "moneyFlow": {
        "throughUs": false,
        "note": "ЮKassa переводит деньги на счёт магазина; агент получает процент от вознаграждения Оператора и денег покупателей не касается",
        "claims": [
          "Y14",
          "Y15"
        ]
      },
      "credentials": {
        "model": "логин и пароль, созданные самим контрагентом; любые действия в кабинете считаются действиями контрагента",
        "sharingRule": "не запрещено, риск на клиенте",
        "claims": [
          "Y11",
          "Y12",
          "Y13"
        ]
      },
      "sourcesClosed": [],
      "gaps": [
        "Роль «Интегратор» нам недоступна — Правила требуют права на переводы денежных средств (Y5)",
        "Условия агентского вознаграждения и права агента по регистрации кабинетов индивидуальны и на сайте не опубликованы (Y2) — выяснять письмом на agents@yoomoney.ru"
      ]
    },
    {
      "id": "cdek",
      "name": "СДЭК",
      "kind": "delivery",
      "partnerProgram": {
        "exists": "не найдено в источниках",
        "type": "нет",
        "entry": "",
        "onBehalfRegistration": "запрещено прямо",
        "claims": [
          "C1",
          "C3"
        ]
      },
      "onboarding": {
        "timing": "не найдено в источниках",
        "steps": [
          {
            "n": 1,
            "title": "Заключение договора: акцепт оферты на сайте либо подписанный договор для интернет-магазина",
            "who": "только клиент",
            "why": "сторона договора — клиент; представитель действует по доверенности",
            "claims": [
              "C5",
              "C6",
              "C4"
            ]
          },
          {
            "n": 2,
            "title": "СДЭК присылает письмо для регистрации в личном кабинете",
            "who": "делает клиент",
            "why": "письмо уходит на адрес клиента",
            "claims": [
              "C2"
            ]
          },
          {
            "n": 3,
            "title": "Клиент переходит по ссылке и САМ создаёт пароль (логин = номер договора)",
            "who": "только клиент",
            "why": "пароля не знает даже СДЭК, передавать его третьим лицам запрещено регламентом",
            "claims": [
              "C3",
              "C1"
            ]
          },
          {
            "n": 4,
            "title": "Подключение СДЭК в ApiShip данными из договора клиента и настройка тарифов",
            "who": "можем сделать мы",
            "why": "агентский аккаунт ApiShip разрешает настраивать кабинеты клиентов",
            "claims": [
              "A1",
              "A4"
            ]
          }
        ]
      },
      "moneyFlow": {
        "throughUs": false,
        "note": "наложенный платёж СДЭК перечисляет магазину на его банковские реквизиты",
        "claims": [
          "C8",
          "C9"
        ]
      },
      "credentials": {
        "model": "логин = номер договора, пароль создаёт клиент по ссылке из письма",
        "sharingRule": "запрещено прямо",
        "claims": [
          "C1",
          "C3"
        ]
      },
      "sourcesClosed": [
        "https://www.cdek.ru/ru/ — JS-челлендж ServicePipe",
        "https://www.cdek.ru/robots.txt — 418",
        "https://integration.cdek.ru/ — 410 Gone",
        "https://api-docs.cdek.ru/ — хост не существует"
      ],
      "gaps": [
        "Партнёрская/интеграторская программа СДЭК — не найдено в источниках: живой сайт для этой машины закрыт, портал integration.cdek.ru отвечает 410",
        "«С клиентом свяжется менеджер» — не найдено в источниках; в опубликованных договоре и регламенте такого шага нет"
      ]
    },
    {
      "id": "pochta",
      "name": "Почта России (онлайн-сервис «Отправка»)",
      "kind": "delivery",
      "partnerProgram": {
        "exists": "не найдено в источниках",
        "type": "нет",
        "entry": "",
        "onBehalfRegistration": "запрещено прямо",
        "claims": [
          "P1",
          "P2"
        ]
      },
      "onboarding": {